Европа;Геормания;Берлин;В городе Ройтлинген есть улица, ширина которой составляет 31 см. За это она попала в Книгу рекордов Гиннеса как самая узкая в мире.;;;;;;;;;;;;;;;;;;;;;;;;;;;;;;;;;;;;;;;;;;;;;D:\Курсовая работа\фраг\germany.gif;;;;;Великобритания;Лондон;Шотландия может похвастаться самым коротким авиарейсом в мире. Он длится 1 минуту 14 секунд с острова Вестра на остров Papa Westray.;;;;;;;;;;;;;;;;;;;;;;;;;;;;;;;;;;;;;;;;;;;;;D:\Курсовая работа\фраг\velikobritaniya.gif;;;;;Франция;Париж;Слова «завтрак», «обед», «ужин», «еда» и все однокоренные и смежные по смыслу священны для французов. «Конкурировать» с этими словами могут только «регби», «велосипед», «футбол». И то, если на сытый желудок. Категорически нельзя звонить французу, когда он ест! Имейте то в виду. И это не шутка. Опоздание с обеда простят скорее, чем если застрял в пробке.;;;;;;;;;;;;;;;;;;;;;;;;;;;;;;;;;;;;;;;;;;;;;D:\Курсовая работа\фраг\france.gif;;;;;Греция;Афины;В Греции живет самое большое количество видов диких животных в Европе. Здесь обитает 107 видов различных рыб, 240 видов птиц, 116 видов млекопитающих, а также 18 видов амфибий.;;;;;;;;;;;;;;;;;;;;;;;;;;;;;;;;;;;;;;;;;;;;;D:\Курсовая работа\фраг\greciya.gif;;;;;Италия;Рим;В Европе есть всего три действующих вулкана: Этна, Стромболи и Везувий. Все они расположены на юге Италии. Интересно знать, что Этна – самый активный вулкан в мире. Он почти непрерывно извергался последние 3500 лет, а с 1999 года он ежедневно извергает лаву.;;;;;;;;;;;;;;;;;;;;;;;;;;;;;;;;;;;;;;;;;;;;;D:\Курсовая работа\фраг\italy.gif;;;;Азия;Непал;Катманду;На территории Непала есть все климатические зоны, имеющиеся на Земле – от вечной мерзлоты до тропиков.;;;;;;;;;;;;;;;;;;;;;;;;;;;;;;;;;;;;;;;;;;;;;D:\Курсовая работа\фраг\nepal.gif;;;;;Япония;Токио;В метро Токио столько людей, что специальные люди утрамбовывают пассажиров в вагоны. Метро здесь, кстати, частное, а не государственное, причём разным компаниям принадлежат разные его ветки.;;;;;;;;;;;;;;;;;;;;;;;;;;;;;;;;;;;;;;;;;;;;;D:\Курсовая работа\фраг\yapan.gif;;;;;Индия;Нью-Дели;Шампунь был впервые придуман в Индии. Но не как коммерческий продукт, а как средство по уходу за волосами. Слово «Шампунь» происходит от санскритского «champu», что означает — массажировать.;;;;;;;;;;;;;;;;;;;;;;;;;;;;;;;;;;;;;;;;;;;;;D:\Курсовая работа\фраг\indiya.gif;;;;;Армения;Ереван;Христианство распространилось в армянском царстве, ныне прекратившем свое существование, вскоре после смерти Иисуса, хотя лишь в начале IV века было принято в качестве государственной религии. Тем не менее, Армения сделала это раньше всех стран на планете.;;;;;;;;;;;;;;;;;;;;;;;;;;;;;;;;;;;;;;;;;;;;;D:\Курсовая работа\фраг\armeniya.gif;;;;;Объединенные Арабские Эмираты;Абу-Даби;В ОАЭ очень хорошая социальная поддержка. За рождение сына государство выделяет семье 50 000 $. На свадьбу выделяют 19 000 $ и виллу, а зарплата госслужащего равна 10 000 $, но только для местных.;;;;;;;;;;;;;;;;;;;;;;;;;;;;;;;;;;;;;;;;;;;;;D:\Курсовая работа\фраг\oae.gif;;;;Африка;Марокко;Рабат;Марокко – мировой лидер по производству марихуаны. При этом самим марокканцам курить гашиш запрещено.;;;;;;;;;;;;;;;;;;;;;;;;;;;;;;;;;;;;;;;;;;;;;D:\Курсовая работа\фраг\marocco.gif;;;;;Мадагаскар;Антананариву; Мадагаскар — первый в мире производитель ванили.;;;;;;;;;;;;;;;;;;;;;;;;;;;;;;;;;;;;;;;;;;;;;D:\Курсовая работа\фраг\madagaskar.gif;;;;;Сомали;Могадишо;Для жителей Сомали взять с собой перед выходом из дома огнестрельное оружие так же естественно, как обуть ботинки. Даже, пожалуй, более естественно, потому что ботинки тут есть не у всех, а вот пистолет или автомат найдётся в каждой, даже самой бедной, хижине.;;;;;;;;;;;;;;;;;;;;;;;;;;;;;;;;;;;;;;;;;;;;;D:\Курсовая работа\фраг\somali.gif;;;;;Египет;Каир;В Египте находится одно из семи чудес древнего мира – Великая пирамида в Гизе (Пирамида Хеопса). Это единственное из всех семи чудес, которое сохранилось до наших дней.;;;;;;;;;;;;;;;;;;;;;;;;;;;;;;;;;;;;;;;;;;;;;D:\Курсовая работа\фраг\egyot.gif;;;;;Зимбабве;Хараре;Значительную долю дохода страны составляет экспорт кофе, по производству которого она занимает одну из лидирующих позиций в мире.;;;;;;;;;;;;;;;;;;;;;;;;;;;;;;;;;;;;;;;;;;;;;D:\Курсовая работа\фраг\zimbabve.gif;;;;Америка;Канада;Оттава;В Канаде расположено больше озер, чем во всех остальных странах мира вместе взятых. Только в провинции Онтарио их насчитывается 250 000. Они содержат около 1/5 мировых запасов пресной воды.;;;;;;;;;;;;;;;;;;;;;;;;;;;;;;;;;;;;;;;;;;;;;D:\Курсовая работа\фраг\canada.gif;;;;;США;Вашингтон;В Штатах самая протяженная сеть автомобильных дорог на планете — 6,5 млн км. Наиболее безлюдная автострада — Трасса-50 (Юта-Калифорния). Она ведет через пустыню, где на 200–300 км встречается всего один населенный пункт.;;;;;;;;;;;;;;;;;;;;;;;;;;;;;;;;;;;;;;;;;;;;;D:\Курсовая работа\фраг\usa.gif;;;;;Куба;Гавана;На Кубе жителям до сих пор выдают продукты первой необходимости по карточкам, что позволяет даже семьям с мизерным доходом не страдать от голода.;;;;;;;;;;;;;;;;;;;;;;;;;;;;;;;;;;;;;;;;;;;;;D:\Курсовая работа\фраг\cuba.gif;;;;;Гондурас;Тегусигальпа;Гондурас – это «банановая республика» в прямом смысле слова, страна занимает второе место в мире по экспорту бананов.;;;;;;;;;;;;;;;;;;;;;;;;;;;;;;;;;;;;;;;;;;;;;D:\Курсовая работа\фраг\gonduras.gif;;;;;Бразилия;Бразилиа; Бразилия считается самым крупным экспортером яблок на планете. Среди мировых поставщиков кофе эта страна также находится в лидерах. Кроме того, в стране выращивают сахарный тростник, кукурузу, рис и цитрусовые.;;;;;;;;;;;;;;;;;;;;;;;;;;;;;;;;;;;;;;;;;;;;;D:\Курсовая работа\фраг\braziliya.gif;;;;Австралия и Океания;Австралия;Канберра;Австралия – единственный материк на Земле, где нет ни одного вулкана или современного оледенения ;;;;;;;;;;;;;;;;;;;;;;;;;;;;;;;;;;;;;;;;;;;;;D:\Курсовая работа\фраг\avstraliya.gif;;;;;Новая Зеландия;Веллингтон;Воду в Голубом озере, которое находится в национальном парке Нельсон-Лейкс, считают самой прозрачной в мире.;;;;;;;;;;;;;;;;;;;;;;;;;;;;;;;;;;;;;;;;;;;;;D:\Курсовая работа\фраг\newzeland.gif;;;;;Фиджи;Сува;Несмотря на скромные размеры государства, на его территории находится почти три десятка аэропортов, пусть большинство из них и не имеет твёрдого покрытия. Просто в состав Фиджи входит 332 острова, и между ними нужно как-то перемещаться, так что лёгкие самолёты отлично подходят для этой цели.;;;;;;;;;;;;;;;;;;;;;;;;;;;;;;;;;;;;;;;;;;;;;D:\Курсовая работа\фраг\fidgi.gif;;;;;Науру;Ярен;Жители Науру считаются самыми толстыми в мире, по статистике, около 95% населения страдает от той или иной степени ожирения.;;;;;;;;;;;;;;;;;;;;;;;;;;;;;;;;;;;;;;;;;;;;;D:\Курсовая работа\фраг\nauru.gif;;;;;Самоа;Апиа;На Самоа практически нет диких животных. Здесь обитает большое количество птиц, особенно певчих, и насекомых, а также коренные обитатели этих мест – летучие лисы.;;;;;;;;;;;;;;;;;;;;;;;;;;;;;;;;;;;;;;;;;;;;;D:\Курсовая работа\фраг\samoa.gif;;;;